{
	"id": "validators_list",
	"description": "List all registered validators",
	"api_category": "validator_management",
	"api_function": "list_validators",
	"tags": ["validators", "plugin_management", "list"],
	"test_spec": {
		"pattern": "simple_list",
		"function_call": {
			"name": "list_validators",
			"args": []
		},
		"assertions": {
			"return_type": "list",
			"list_item_type": "string"
		}
	}
}
